{
  "$schema": "https://json-schema.org/draft/2020-12/schema",
  "$id": "https://easynet.run/sdk/schemas/mission-run-file-request.schema.json",
  "title": "MissionRunFileRequest",
  "type": "object",
  "additionalProperties": false,
  "required": [
    "caller_ura",
    "callee_ura",
    "subject_ura",
    "descriptor_version",
    "nonce_base64",
    "causal_context",
    "path"
  ],
  "properties": {
    "caller_ura": {"type": "string", "minLength": 1},
    "callee_ura": {"type": "string", "minLength": 1},
    "subject_ura": {"type": "string", "minLength": 1},
    "descriptor_version": {"type": "string", "minLength": 1},
    "nonce_base64": {"type": "string", "minLength": 1},
    "causal_context": {"type": "object"},
    "path": {"type": "string", "minLength": 1},
    "label": {"type": "string", "minLength": 1},
    "metadata": {"type": "object"}
  }
}
